{
  "schema_version": "1.0.0",
  "scenario_id": "BX-BH01-SCENARIO-PHASE8-BROWSER-MATRIX",
  "status": "blocked",
  "owner": "quality-owner",
  "requirement_refs": ["BH-01-PHASE-8", "BX-BH01-INPUT-BROWSERS", "BX-BH01-INPUT-BEHAVIORS", "BX-BH01-INPUT-PRIVATE-API", "BX-BH01-INPUT-STOP-CONDITIONS", "BX-BH01-RISK-MOBILE-PERFORMANCE"],
  "profiles": ["browser-phoenix-phase8", "chrome-for-testing-152.0.7977.75", "playwright-firefox-153-unqualified-probe", "playwright-webkit-26.5-linux-unqualified-probe"],
  "preconditions": ["Phase 7 gate passed and Phase 8 was explicitly authorized.", "The five required browser rows remain materialized even when unavailable.", "The current generated profile manifest is SHA-256 818ac7b967db6519c766f9d1fff80455cc92d205e3f188252e6da27258ee4aad.", "Engine probes are marked experimental and cannot substitute for stable vendor browsers or required devices."],
  "steps": ["Verify all required environment rows, controls, artifacts, and scheduling policy.", "Execute prerequisite, behavior/trust, accessibility/input, and compatibility suites in every locally executable environment against one profile identity.", "Reconcile retained Phase 5-7 semantics, server authority, diagnostics, resources, and optional-adapter evidence.", "Classify every unavailable browser, device, assistive-technology pairing, adjacent package, and observable control without omission.", "Apply the Phase 8 gate and stop before Phase 9 when any required row or manual evidence remains blocked."],
  "expected_results": ["Every executed scenario fails closed or produces the same normalized semantic outcome without unauthorized effects or retained transient resources.", "Accessible fallback remains bounded, announced, keyboard reachable, retryable by user action, and free of partial runtime activation.", "Version and protocol mismatch is detected before unsafe use; LiveView private data remains in its optional adapter and exact pins stay authoritative.", "Missing required browser/device/AT evidence yields an explicit blocked decision and Phase 9 remains ineligible and unauthorized."],
  "prohibited_results": ["A Linux WebKit engine probe is represented as Safari.", "A patched Firefox engine probe substitutes for stable Firefox.", "Desktop emulation substitutes for Chrome Android, iPhone, or iPad execution.", "Automated semantic inspection substitutes for assistive-technology review.", "A partial matrix, changed profile, retry, quarantine, or absent row is represented as a pass.", "Exact-stack feasibility is represented as a dependency range, browser support, accessibility conformance, production readiness, or security certification."],
  "evidence_types": ["environment-fingerprint", "actual-browser-observation", "normalized-semantic-trace", "fallback-accessibility-observation", "compatibility-mismatch-result", "server-audit-observation", "resource-convergence-report", "blocked-decision"]
}
